{"$schema":"https://json-schema.org/draft/2020-12/schema","additionalProperties":true,"properties":{"agent":{"additionalProperties":true,"properties":{"architecture":{"additionalProperties":true,"properties":{"core_concepts":{"items":{"type":"string"},"type":"array"},"dependency_rules":{"additionalProperties":true,"type":"object"},"key_flows":{"items":{"type":"object"},"type":"array"},"non_goals":{"items":{"type":"string"},"type":"array"},"responsibilities":{"items":{"type":"string"},"type":"array"}},"required":["responsibilities","non_goals","core_concepts","key_flows","dependency_rules"],"type":"object"},"integration":{"additionalProperties":true,"properties":{"entrypoints":{"items":{"type":"string"},"type":"array"},"runtime_notes":{"items":{"type":"string"},"type":"array"},"used_by":{"items":{"type":"string"},"type":"array"},"uses":{"items":{"type":"string"},"type":"array"}},"required":["entrypoints","used_by","uses","runtime_notes"],"type":"object"},"inventory":{"additionalProperties":true,"properties":{"files":{"items":{"type":"object"},"type":"array"},"subdirs":{"items":{"type":"object"},"type":"array"}},"required":["files","subdirs"],"type":"object"},"summary":{"additionalProperties":true,"properties":{"detail":{"type":"string"},"one_liner":{"type":"string"}},"required":["one_liner","detail"],"type":"object"},"testing":{"additionalProperties":true,"properties":{"commands":{"items":{"type":"string"},"type":"array"},"recommended_when_changed":{"items":{"type":"string"},"type":"array"},"required_when_changed":{"items":{"type":"string"},"type":"array"}},"required":["commands","required_when_changed","recommended_when_changed"],"type":"object"}},"required":["summary","architecture","inventory","integration","testing"],"type":"object"},"computed":{"additionalProperties":true,"properties":{"checksums":{"additionalProperties":true,"properties":{"analyzer_version":{"type":["string","null"]},"ctx_semantic_hash_sha256":{"type":["string","null"]},"subtree_hash_sha256":{"type":["string","null"]},"template_version":{"type":["string","null"]}},"required":["subtree_hash_sha256","ctx_semantic_hash_sha256","template_version","analyzer_version"],"type":"object"},"freshness_state":{"enum":["missing","stale","fresh","needs_review","blocked"]},"last_scan":{"additionalProperties":true,"properties":{"scan_id":{"type":["string","null"]},"scanned_at":{"type":["string","null"]}},"type":"object"},"review":{"additionalProperties":true,"properties":{"last_review_scan_id":{"type":["string","null"]},"review_every_n_scans":{"minimum":0,"type":"integer"},"scan_counter":{"minimum":0,"type":"integer"}},"type":"object"},"staleness_reasons":{"items":{"type":"string"},"type":"array"}},"required":["freshness_state","staleness_reasons","checksums"],"type":"object"},"identity":{"additionalProperties":true,"properties":{"ctx_path":{"type":"string"},"dir_path":{"type":"string"},"name":{"type":"string"}},"required":["dir_path","ctx_path","name"],"type":"object"},"kind":{"const":"dir_ctx"},"schema_version":{"minimum":1,"type":"integer"}},"required":["kind","schema_version","identity","agent","computed"],"title":"dir_ctx","type":"object"}