{
    "agent": {
        "architecture": {
            "core_concepts": [
                "Directory context",
                "melder structure"
            ],
            "dependency_rules": {},
            "key_flows": [],
            "non_goals": [],
            "responsibilities": [
                "Hold melder directory contents",
                "Define local structure"
            ]
        },
        "integration": {
            "entrypoints": [],
            "runtime_notes": [],
            "used_by": [],
            "uses": []
        },
        "inventory": {
            "files": [
                {
                    "name": "____author____.json"
                },
                {
                    "name": "____description____.json"
                },
                {
                    "name": "____license____.json"
                },
                {
                    "name": "____melder_registration_guard____.json"
                },
                {
                    "name": "____version____.json"
                },
                {
                    "name": "__author__.py"
                },
                {
                    "name": "__description__.py"
                },
                {
                    "name": "__init__.py"
                },
                {
                    "name": "__license__.py"
                },
                {
                    "name": "__melder_registration_guard__.py"
                },
                {
                    "name": "__version__.py"
                }
            ],
            "subdirs": [
                {
                    "name": "__pycache__"
                },
                {
                    "name": "aether"
                },
                {
                    "name": "crystallizer"
                },
                {
                    "name": "spellbook"
                },
                {
                    "name": "utilities"
                }
            ]
        },
        "summary": {
            "detail": "Directory context for src/melder.",
            "one_liner": "melder directory."
        },
        "testing": {
            "commands": [],
            "recommended_when_changed": [],
            "required_when_changed": []
        }
    },
    "computed": {
        "checksums": {
            "analyzer_version": null,
            "ctx_semantic_hash_sha256": null,
            "subtree_hash_sha256": null,
            "template_version": "dir_ctx@v1"
        },
        "freshness_state": "fresh",
        "last_scan": {},
        "review": {},
        "staleness_reasons": []
    },
    "identity": {
        "ctx_path": "src/melder/__melder__.dir.json",
        "dir_path": "src/melder",
        "name": "melder"
    },
    "kind": "dir_ctx",
    "schema_version": 1
}